[
	{
		"id": "core.deep_water",
		"terrain_id": "core.deep_water",
		"height_range": [-1.0, -0.60],
		"moisture_range": [-1.0, 1.0],
		"temperature_range": [-1.0, 1.0],
		"base_score": 0.55,
		"height_weight": 2.1,
		"moisture_weight": 0.0,
		"temperature_weight": 0.0,
		"variation_weight": 0.0,
		"range_falloff": 0.18
	},
	{
		"id": "core.water",
		"terrain_id": "core.water",
		"height_range": [-0.64, -0.33],
		"moisture_range": [-1.0, 1.0],
		"temperature_range": [-1.0, 1.0],
		"base_score": 0.45,
		"height_weight": 1.9,
		"moisture_weight": 0.0,
		"temperature_weight": 0.0,
		"variation_weight": 0.0,
		"range_falloff": 0.22
	},
	{
		"id": "core.sand",
		"terrain_id": "core.sand",
		"height_range": [-0.38, 0.16],
		"moisture_range": [-1.0, 0.08],
		"temperature_range": [0.05, 1.0],
		"base_score": 0.14,
		"height_weight": 0.50,
		"moisture_weight": 0.70,
		"temperature_weight": 0.32,
		"variation_weight": 0.05,
		"range_falloff": 0.40
	},
	{
		"id": "core.dry_dirt",
		"terrain_id": "core.dry_dirt",
		"height_range": [-0.28, 0.92],
		"moisture_range": [-0.75, 0.05],
		"temperature_range": [-0.65, 0.96],
		"base_score": 0.18,
		"height_weight": 0.26,
		"moisture_weight": 0.74,
		"temperature_weight": 0.10,
		"variation_weight": 0.11,
		"range_falloff": 0.46
	},
	{
		"id": "core.dry_grass",
		"terrain_id": "core.dry_grass",
		"height_range": [-0.24, 0.82],
		"moisture_range": [-0.05, 0.50],
		"temperature_range": [-0.55, 0.78],
		"base_score": 0.23,
		"height_weight": 0.23,
		"moisture_weight": 0.66,
		"temperature_weight": 0.13,
		"variation_weight": 0.10,
		"range_falloff": 0.48
	},
	{
		"id": "core.grass",
		"terrain_id": "core.grass",
		"height_range": [-0.30, 0.78],
		"moisture_range": [0.30, 1.0],
		"temperature_range": [-0.80, 0.68],
		"base_score": 0.16,
		"height_weight": 0.25,
		"moisture_weight": 0.82,
		"temperature_weight": 0.20,
		"variation_weight": 0.04,
		"range_falloff": 0.52
	},
	{
		"id": "core.red_desert",
		"terrain_id": "core.red_desert",
		"height_range": [-0.12, 1.0],
		"moisture_range": [-1.0, -0.30],
		"temperature_range": [0.20, 1.0],
		"base_score": 0.26,
		"height_weight": 0.22,
		"moisture_weight": 0.96,
		"temperature_weight": 0.42,
		"variation_weight": 0.18,
		"range_falloff": 0.50
	},
	{
		"id": "core.stone_ground",
		"terrain_id": "core.stone_ground",
		"height_range": [0.12, 1.0],
		"moisture_range": [-1.0, 0.48],
		"temperature_range": [-0.85, 0.96],
		"base_score": 0.18,
		"height_weight": 0.62,
		"moisture_weight": 0.36,
		"temperature_weight": 0.08,
		"variation_weight": 0.55,
		"range_falloff": 0.44
	},
	{
		"id": "core.dirt",
		"terrain_id": "core.dirt",
		"height_range": [-0.34, 1.0],
		"moisture_range": [-0.55, 0.58],
		"temperature_range": [-1.0, 0.88],
		"base_score": 0.13,
		"height_weight": 0.24,
		"moisture_weight": 0.44,
		"temperature_weight": 0.08,
		"variation_weight": 0.04,
		"range_falloff": 0.50
	},
	{
		"id": "core.base_soil",
		"terrain_id": "core.base_soil",
		"height_range": [-0.34, 1.0],
		"moisture_range": [-1.0, 0.32],
		"temperature_range": [-0.20, 1.0],
		"base_score": 0.09,
		"height_weight": 0.16,
		"moisture_weight": 0.32,
		"temperature_weight": 0.16,
		"variation_weight": 0.03,
		"range_falloff": 0.55
	}
]
